{
  "schema_version": "1.0",
  "id": "WAVE-001",
  "title": "Seasonal work and labor-to-cost operations",
  "status": "implementation_ready",
  "workflow_ids": ["WF-001", "WF-007"],
  "screen_ids": [
    "SCR-001",
    "SCR-002",
    "SCR-003",
    "SCR-004",
    "SCR-005",
    "SCR-006",
    "SCR-039",
    "SCR-040",
    "SCR-041",
    "SCR-042",
    "SCR-043",
    "SCR-044",
    "SCR-045"
  ],
  "public_component_ids": [
    "CMP-001",
    "CMP-002",
    "CMP-003",
    "CMP-004",
    "CMP-005",
    "CMP-006",
    "CMP-007",
    "CMP-008",
    "CMP-009",
    "CMP-010",
    "CMP-011",
    "CMP-012",
    "CMP-013",
    "CMP-014",
    "CMP-015",
    "CMP-016",
    "CMP-017",
    "CMP-018",
    "CMP-019",
    "CMP-020",
    "CMP-021",
    "CMP-022",
    "CMP-026",
    "CMP-033",
    "CMP-034",
    "CMP-035",
    "CMP-036"
  ],
  "flow_ids": ["FLW-001", "FLW-007", "FLW-015"],
  "construction_packet_ids": ["PKT-002", "PKT-003", "PKT-004"],
  "state_inventory": [
    {
      "screen_id": "SCR-001",
      "route": "/screens/SCR-001",
      "platform": "responsive",
      "review_states": ["normal", "offline", "partial", "urgent", "completion"],
      "state_sources": [
        {
          "state": "normal",
          "evidence_status": "fixture_realized",
          "state_matrix_ids": ["STM-0001", "STM-0002", "STM-0003"]
        },
        {
          "state": "offline",
          "evidence_status": "fixture_realized",
          "state_matrix_ids": ["STM-0004"]
        },
        {
          "state": "partial",
          "evidence_status": "fixture_realized",
          "state_matrix_ids": ["STM-0005"]
        },
        {
          "state": "urgent",
          "evidence_status": "model_only",
          "state_matrix_ids": ["STM-0006"]
        },
        {
          "state": "completion",
          "evidence_status": "model_only",
          "state_matrix_ids": ["STM-0007"]
        }
      ],
      "fixture_ids": ["FIX-002", "FIX-005", "FIX-006", "FIX-003", "FIX-033"]
    },
    {
      "screen_id": "SCR-002",
      "route": "/screens/SCR-002",
      "platform": "responsive",
      "review_states": ["normal", "blocked", "partial", "completion"],
      "state_sources": [
        {
          "state": "normal",
          "evidence_status": "fixture_realized",
          "state_matrix_ids": ["STM-0008", "STM-0009"]
        },
        {
          "state": "blocked",
          "evidence_status": "fixture_realized",
          "state_matrix_ids": ["STM-0010"]
        },
        {
          "state": "partial",
          "evidence_status": "fixture_realized",
          "state_matrix_ids": ["STM-0011"]
        },
        {
          "state": "completion",
          "evidence_status": "model_only",
          "state_matrix_ids": ["STM-0012"]
        }
      ],
      "fixture_ids": [
        "FIX-002",
        "FIX-052",
        "FIX-005",
        "FIX-006",
        "FIX-003",
        "FIX-033"
      ]
    },
    {
      "screen_id": "SCR-003",
      "route": "/screens/SCR-003",
      "platform": "responsive",
      "review_states": ["normal", "blocked", "stale", "partial", "completion"],
      "state_sources": [
        {
          "state": "normal",
          "evidence_status": "fixture_realized",
          "state_matrix_ids": [
            "STM-0013",
            "STM-0014",
            "STM-0015",
            "STM-0016",
            "STM-0017"
          ]
        },
        {
          "state": "blocked",
          "evidence_status": "fixture_realized",
          "state_matrix_ids": ["STM-0018"]
        },
        {
          "state": "stale",
          "evidence_status": "fixture_realized",
          "state_matrix_ids": ["STM-0019"]
        },
        {
          "state": "partial",
          "evidence_status": "fixture_realized",
          "state_matrix_ids": ["STM-0020"]
        },
        {
          "state": "completion",
          "evidence_status": "model_only",
          "state_matrix_ids": ["STM-0021"]
        }
      ],
      "fixture_ids": [
        "FIX-002",
        "FIX-052",
        "FIX-003",
        "FIX-053",
        "FIX-004",
        "FIX-054",
        "FIX-005",
        "FIX-006",
        "FIX-033"
      ]
    },
    {
      "screen_id": "SCR-004",
      "route": "/screens/SCR-004",
      "platform": "responsive",
      "review_states": [
        "normal",
        "blocked",
        "stale",
        "corrected",
        "completion"
      ],
      "state_sources": [
        {
          "state": "normal",
          "evidence_status": "fixture_realized",
          "state_matrix_ids": ["STM-0022", "STM-0023"]
        },
        {
          "state": "blocked",
          "evidence_status": "fixture_realized",
          "state_matrix_ids": ["STM-0024"]
        },
        {
          "state": "stale",
          "evidence_status": "fixture_realized",
          "state_matrix_ids": ["STM-0025"]
        },
        {
          "state": "corrected",
          "evidence_status": "model_only",
          "state_matrix_ids": ["STM-0026"]
        },
        {
          "state": "completion",
          "evidence_status": "model_only",
          "state_matrix_ids": ["STM-0027"]
        }
      ],
      "fixture_ids": ["FIX-002", "FIX-052", "FIX-003", "FIX-053", "FIX-033"]
    },
    {
      "screen_id": "SCR-005",
      "route": "/screens/SCR-005",
      "platform": "mobile",
      "review_states": [
        "normal",
        "blocked",
        "corrected",
        "historical",
        "completion"
      ],
      "state_sources": [
        {
          "state": "normal",
          "evidence_status": "fixture_realized",
          "state_matrix_ids": ["STM-0028", "STM-0029", "STM-0030", "STM-0031"]
        },
        {
          "state": "blocked",
          "evidence_status": "fixture_realized",
          "state_matrix_ids": ["STM-0032"]
        },
        {
          "state": "corrected",
          "evidence_status": "fixture_realized",
          "state_matrix_ids": ["STM-0033"]
        },
        {
          "state": "historical",
          "evidence_status": "model_only",
          "state_matrix_ids": ["STM-0034"]
        },
        {
          "state": "completion",
          "evidence_status": "model_only",
          "state_matrix_ids": ["STM-0035"]
        }
      ],
      "fixture_ids": ["FIX-002", "FIX-052", "FIX-004", "FIX-054"]
    },
    {
      "screen_id": "SCR-006",
      "route": "/screens/SCR-006",
      "platform": "responsive",
      "review_states": [
        "normal",
        "stale",
        "corrected",
        "offline",
        "completion"
      ],
      "state_sources": [
        {
          "state": "normal",
          "evidence_status": "fixture_realized",
          "state_matrix_ids": ["STM-0036", "STM-0037", "STM-0038"]
        },
        {
          "state": "stale",
          "evidence_status": "fixture_realized",
          "state_matrix_ids": ["STM-0039"]
        },
        {
          "state": "corrected",
          "evidence_status": "fixture_realized",
          "state_matrix_ids": ["STM-0040"]
        },
        {
          "state": "offline",
          "evidence_status": "model_only",
          "state_matrix_ids": ["STM-0041"]
        },
        {
          "state": "completion",
          "evidence_status": "model_only",
          "state_matrix_ids": ["STM-0042"]
        }
      ],
      "fixture_ids": ["FIX-003", "FIX-053", "FIX-004", "FIX-054", "FIX-033"]
    },
    {
      "screen_id": "SCR-039",
      "route": "/screens/SCR-039",
      "platform": "responsive",
      "review_states": [
        "normal",
        "blocked",
        "urgent",
        "historical",
        "completion"
      ],
      "state_sources": [
        {
          "state": "normal",
          "evidence_status": "fixture_realized",
          "state_matrix_ids": ["STM-0269", "STM-0270", "STM-0271"]
        },
        {
          "state": "blocked",
          "evidence_status": "fixture_realized",
          "state_matrix_ids": ["STM-0272"]
        },
        {
          "state": "urgent",
          "evidence_status": "model_only",
          "state_matrix_ids": ["STM-0273"]
        },
        {
          "state": "historical",
          "evidence_status": "fixture_realized",
          "state_matrix_ids": ["STM-0274"]
        },
        {
          "state": "completion",
          "evidence_status": "model_only",
          "state_matrix_ids": ["STM-0275"]
        }
      ],
      "fixture_ids": ["FIX-032", "FIX-047"]
    },
    {
      "screen_id": "SCR-040",
      "route": "/screens/SCR-040",
      "platform": "responsive",
      "review_states": ["normal", "urgent", "partial", "offline", "completion"],
      "state_sources": [
        {
          "state": "normal",
          "evidence_status": "fixture_realized",
          "state_matrix_ids": ["STM-0276", "STM-0277", "STM-0278"]
        },
        {
          "state": "urgent",
          "evidence_status": "fixture_realized",
          "state_matrix_ids": ["STM-0279"]
        },
        {
          "state": "partial",
          "evidence_status": "fixture_realized",
          "state_matrix_ids": ["STM-0280"]
        },
        {
          "state": "offline",
          "evidence_status": "model_only",
          "state_matrix_ids": ["STM-0281"]
        },
        {
          "state": "completion",
          "evidence_status": "model_only",
          "state_matrix_ids": ["STM-0282"]
        }
      ],
      "fixture_ids": [
        "FIX-034",
        "FIX-032",
        "FIX-033",
        "FIX-036",
        "FIX-035",
        "FIX-003",
        "FIX-047",
        "FIX-031"
      ]
    },
    {
      "screen_id": "SCR-041",
      "route": "/screens/SCR-041",
      "platform": "mobile",
      "review_states": ["normal", "blocked", "urgent", "stale", "completion"],
      "state_sources": [
        {
          "state": "normal",
          "evidence_status": "model_only",
          "state_matrix_ids": ["STM-0283", "STM-0284"]
        },
        {
          "state": "blocked",